{
  "schema": "zerosum.payment_event.v1",
  "event_id": "01996a3f-0001-7000-8000-000000000002:REFUND_SUCCEEDED",
  "event_type": "REFUND_SUCCEEDED",
  "attempt_id": "01996a3f-0001-7000-8000-000000000002",
  "order_group_id": "trip_8f2c",
  "source_order_id": "01996a3e-8f10-7c2a-9a1e-3d5c7b2e4f03",
  "entity_id": "rider:R1",
  "provider": "fakecard",
  "provider_ref": "re_0001",
  "money": { "currency": "USD", "amount_minor": 300 },
  "occurred_at": "2026-09-15T10:21:30.400Z"
}
