{
  "schema": "zerosum.payment_event.v1",
  "event_id": "01996a3f-0001-7000-8000-000000000004:CHARGE_DECLINED",
  "event_type": "CHARGE_DECLINED",
  "attempt_id": "01996a3f-0001-7000-8000-000000000004",
  "order_group_id": "trip_9a1b",
  "source_order_id": "01996a3e-8f10-7c2a-9a1e-3d5c7b2e4f11",
  "entity_id": "rider:R2",
  "provider": "fakecard",
  "failure_code": "card_declined",
  "money": { "currency": "USD", "amount_minor": 1500 },
  "occurred_at": "2026-09-15T12:00:00.000Z"
}
