{
  "schema": "zerosum.payment_event.v1",
  "event_id": "01996a3f-0001-7000-8000-000000000001:CHARGE_SUCCEEDED",
  "event_type": "CHARGE_SUCCEEDED",
  "attempt_id": "01996a3f-0001-7000-8000-000000000001",
  "order_group_id": "trip_8f2c",
  "source_order_id": "01996a3e-8f10-7c2a-9a1e-3d5c7b2e4f01",
  "entity_id": "rider:R1",
  "provider": "fakecard",
  "provider_ref": "ch_0001",
  "money": { "currency": "USD", "amount_minor": 2500 },
  "occurred_at": "2026-09-15T10:04:11.702Z"
}
